before	after	comments
Inspiré de l' architecture romaine et haut d' une cinquantaine de mètres , il porte quatre statues sur chacun de ses quatre piliers :	Inspiré de l' architecture romaine et haut d' une cinquantaine de mètres , il porte une statue sur chacun de ses quatre piliers :	il porte quatre statues sur chacun de ses quatre piliers -> il porte une statue sur chacun de ses quatre piliers
Commandé par Napoléon en 1806 , ce monument fut érigé au XIXe et achevé en 1836 .	Commandé par Napoléon en 1806 , ce monument fut érigé au XIX e et achevé en 1836 .	correction de numéraux
Sur les faces extérieures de l' Arc sont gravés les noms des grands Révolutionnaires et des victoires militaires de Napoléon Ier .	Sur les faces extérieures de l' Arc sont gravés les noms des grands Révolutionnaires et des victoires militaires de Napoléon I er .	correction de numéraux
Sur les murs intérieurs du monument sont inscrits les noms de 558 officiers d' Empireet de la république .	Sur les murs intérieurs du monument sont inscrits les noms de 558 officiers d' Empire et de la république .	Histoire
Pour une personne située sur les Champ-Élysées , le disque solaire est ainsi visible quelques minutes sous l' arche de l' Arc de Triomphe .	Pour une personne située sur les Champs-Élysées , le disque solaire est ainsi visible quelques minutes sous l' arche de l' Arc de Triomphe .	Divers
