before	after	comments
Antoine Meillet ( né Paul-Jules-Antoine Meillet 11 novembre 1866-21 septembre 1936 ) est le principal linguiste français des premières décennies du XXe siècle .	Antoine Meillet ( né Paul-Jules-Antoine Meillet 11 novembre 1866-21 septembre 1936 ) est le principal linguiste français des premières décennies du XX e siècle .	correction de numéraux
 A la Sorbonne , Meillet surveille le travail Milman Parry .	 À la Sorbonne , Meillet surveille le travail de Milman Parry .	ortho
Il a formé toute une génération de linguistes français , parmi lesquel Emile Benveniste , Marcel Cohen , Georges Dumézil , André Martinet , Aurélien Sauvageot , Lucien Tesnière , Joseph Vendryes .	Il a formé toute une génération de linguistes français , parmi lesquels Emile Benveniste , Marcel Cohen , Georges Dumézil , André Martinet , Aurélien Sauvageot , Lucien Tesnière , Joseph Vendryes .	nettoyage , Typos fixed : lesquel → lesquels , AWB
On peut alors décider le PNB des 8 pays à une date donnée ou l' ordre des pays est ordoné .	On peut alors décider le PNB des 8 pays à une date donnée ou l' ordre des pays est ordonné .	Présentation élémentaire
L' algèbre linéaire moderne a été étendu pour considérer les espaces de dimension arbitraire ou infini .	L' algèbre linéaire moderne a été étendue pour considérer les espaces de dimension arbitraire ou infini .	Présentation élémentaire
Un théorème intéressant à l' époque des mémoires d' ordinateurs de petite taille était qu ' on pouvait travailler séparément sur des sous-ensembles (" blocs " ) d' une matrice en les combinant ensuite par les mêmes règles qu ' on utilise pour combiner des scalaires dans le matrrices .	Un théorème intéressant à l' époque des mémoires d' ordinateurs de petite taille était qu ' on pouvait travailler séparément sur des sous-ensembles (" blocs " ) d' une matrice en les combinant ensuite par les mêmes règles qu ' on utilise pour combiner des scalaires dans le matrices .	Quelques théorèmes
On nomme algèbre linéaire la branche des mathématiques qui s' occupe de l' étude des vecteurs ( ensembles ordonnés de scalaires ) , des espaces vectoriels ( ou espaces linéaires ) , des transformation linéaires et des systèmes d' équation linéaires ( théorie des matrices ) .	On nomme algèbre linéaire la branche des mathématiques qui s' occupe de l' étude des vecteurs ( ensembles ordonnés de scalaires ) , des espaces vectoriels ( ou espaces linéaires ) , des transformations linéaires et des systèmes d' équation linéaires ( théorie des matrices ) .	typo + lien + modif
Un vecteur , ici , est une segment de droite caractérisé à la fois par sa longeur ( ou magnitude ) et sa direction .	Un vecteur , ici , est un segment de droite caractérisé à la fois par sa longeur ( ou magnitude ) et sa direction .	typo + lien + modif
On nomme algèbre linéaire la branche des mathématiques qui s' occupe de l' étude des vecteurs ( ensembles ordonnés de scalaires ) , des espaces vectoriels ( ou espaces linéaires ) , des transformations linéaires et des systèmes d' équation linéaires ( théorie des matrices ) .	On nomme algèbre linéaire la branche des mathématiques qui s' occupe de l' étude des vecteurs ( ensembles ordonnés de scalaires ) , des espaces vectoriels ( ou espaces linéaires ) , des transformations linéaires et des systèmes d' équations linéaires ( théorie des matrices ) .	ortho
En 1844 , Hermann Grassmann publie un livre Die lineare Ausdehnungsleshre .	En 1844 , Hermann Grassmann publie un livre Die lineare Ausdehnungslehre .	
Ce n' est qu ' au XIXeme siècle que l' algèbre linéaire devient une branche des mathématiques à part entière .	Ce n' est qu ' au XIXe siècle que l' algèbre linéaire devient une branche des mathématiques à part entière .	XXe siècle
Le début du XXeme siècle voit la naissance de la formalisation moderne des mathématiques .	Le début du XXe siècle voit la naissance de la formalisation moderne des mathématiques .	XXe siècle
On nomme Algebre lineaire la branche des mathématiques qui se penche sur l' étude des espaces vectoriels ( ou espaces linéaires ) , de leurs éléments les vecteurs , des transformations linéaires et des systèmes d' équations linéaires ( théorie des matrices ) .	On nomme Algèbre lineaire la branche des mathématiques qui se penche sur l' étude des espaces vectoriels ( ou espaces linéaires ) , de leurs éléments les vecteurs , des transformations linéaires et des systèmes d' équations linéaires ( théorie des matrices ) .	Définition
Les espaces vectoriels deviennent alors une structure générale omni-présente dans presques tout les domaines mathématiques .	Les espaces vectoriels deviennent alors une structure générale omni-présente dans presque tous les domaines mathématiques .	ortho , mise en page , wikif
Lalgèbre lineaire est la branche des mathématiques qui s' intéresse à l' étude des espaces vectoriels ( ou espaces linéaires ) , de leurs éléments les vecteurs , des transformations linéaires et des systèmes d' équations linéaires ( théorie des matrices ) .	Lalgèbre linéaire est la branche des mathématiques qui s' intéresse à l' étude des espaces vectoriels ( ou espaces linéaires ) , de leurs éléments les vecteurs , des transformations linéaires et des systèmes d' équations linéaires ( théorie des matrices ) .	
Le terme algèbre abstraite est utilisé pour la distinguer de l' algèbre élémentaire qui enseigne les règles de manipulation des formules et des expressions algébriques .	Le terme algèbre abstraite est utilisé pour la distinguer de lalgèbre élémentaire qui enseigne les règles de manipulation des formules et des expressions algébriques .	
 Lalgorithmique ou algorithmie est la science des algorithmes , visant à étudier les séquences d' instructions dans un programme informatique .	 L' algorithmique ou algorithmie est la science des algorithmes , visant à étudier les séquences d' instructions dans un programme informatique .	nowiki
Souvent l' efficacité d' un algorithme n' est connue que de manière asymptotique , c' est à dire pour de grandes valeurs du paramètre n, alors que pour une utilisation dans des conditions réalistes de	Souvent l' efficacité d' un algorithme n' est connue que de manière asymptotique , c' est-à- dire pour de grandes valeurs du paramètre n, alors que pour une utilisation dans des conditions réalistes de	c' est à dire -> c' est-à- dire
La principale notion mathématique dans le calcul du coût d' un algorithme précis sont les notions de négligeablité ( notée o( f( n)), « petit o ») et de domination ( notée O( f( n)), « grand o »), où f est une fonction mathématique de n, variable désignant la quantité d' informations ( en bits , en nombre d' enregistrements … ) manipulée dans l' algorithme .	La principale notion mathématique dans le calcul du coût d' un algorithme précis sont les notions de négligeabilité ( notée o( f( n)), « petit o ») et de domination ( notée O( f( n)), « grand o »), où f est une fonction mathématique de n, variable désignant la quantité d' informations ( en bits , en nombre d' enregistrements … ) manipulée dans l' algorithme .	typo Complexité algorithmique
Ainsi , le Quicksort ( ou tri rapide ) , lorsque l' on choisi le premier élément comme pivot , se comporte de façon désastreuse si on l' applique à une liste de valeur .	Ainsi , le Quicksort ( ou tri rapide ) , lorsque l' on choisit le premier élément comme pivot , se comporte de façon désastreuse si on l' applique à une liste de valeur .	Quelques indications sur l' efficacité des algorithmes
Le substantif algorithmique désigne la méthode utilisant des algotithmes .	Le substantif algorithmique désigne la méthode utilisant des algorithmes .	Etude systématique
Le terme est éégalement employé comme adjectf .	Le terme est éégalement employé comme adjectif .	Etude systématique
Le terme est éégalement employé comme adjectif .	Le terme est également employé comme adjectif .	Etude systématique
Le mot vient du nom du matématicien perse Abou Jafar Muhammad Ibn Mūsa al-Khuwārizmī ( en arabe :	Le mot vient du nom du mathématicien perse Abou Jafar Muhammad Ibn Mūsa al-Khuwārizmī ( en arabe :	
Au dix-septième siècle , on pourrait entrevroir une certaine allusion à la méthode algorithmique chez René Descartes dans la méthode générale proposée par le Discours de la méthode ( 1637 ) , notamment quand , en sa deuxième partie , le logicien français propose de :	Au dix-septième siècle , on pourrait entrevoir une certaine allusion à la méthode algorithmique chez René Descartes dans la méthode générale proposée par le Discours de la méthode ( 1637 ) , notamment quand , en sa deuxième partie , le logicien français propose de :	Etude systématique
Le savant arabophone andalou Averroès ( 1126 -1198 ) évoque une méthode de raisonnement où la thèse s' affine étape par étape ( itérativement ) jusqu ' à une certaine convergence , et ceci conformément au déroulement d' un algorithme .	Le savant arabophone andalou Averroès ( 1126 -1198 ) évoque une méthode de raisonnement où la thèse s' affine étape par étape ( itérativement ) jusqu ' à une certaine convergence et ceci conformément au déroulement d' un algorithme .	relecture syntaxe et orthographe
 La principale notion mathématique dans le calcul du coût d' un algorithme précis sont les notions de négligeabilité ( notée o( f( n)), « petit o ») et de domination ( notée O( f( n)), « grand o »), où f est une fonction mathématique de n, variable désignant la quantité d' informations ( en bits , en nombre d' enregistrements … ) manipulée dans l' algorithme .	 Les principales notions mathématiques dans le calcul du coût d' un algorithme précis sont les notions de négligeabilité ( notée o( f( n)), « petit o ») et de domination ( notée O( f( n)), « grand o »), où f est une fonction mathématique de n, variable désignant la quantité d' informations ( en bits , en nombre d' enregistrements … ) manipulée dans l' algorithme .	relecture syntaxe et orthographe
Baser le calcul de la complexité d' un algorithme sur le temps qu ' un ordinateur particulier prend pour effectuer le-dit algorithme ne permet pas de prendre en compte la structure interne de l' algorithme ni la particularité de l' ordinateur :	Baser le calcul de la complexité d' un algorithme sur le temps qu ' un ordinateur particulier prend pour effectuer ledit algorithme ne permet pas de prendre en compte la structure interne de l' algorithme , ni la particularité de l' ordinateur :	relecture syntaxe et orthographe
Si les tâches s' exécutent sur un réseau de processeurs on parle d' algoritme distribué .	Si les tâches s' exécutent sur un réseau de processeurs on parle d' algorithme distribué .	coquille
Si les opérations s' éxécutent sur plusieurs processeurs en parallèle , on parle d' algorithme parallèle .	Si les opérations s' exécutent sur plusieurs processeurs en parallèle , on parle d' algorithme parallèle .	Définition
On se réfèrera aux articles suivants pour de plus amples détails :	On se référera aux articles suivants pour de plus amples détails :	Exemples d' algorithme
algorithme de tri , le nombre de lignes à trier ) , que l' on privégéliera sur le coût exact en secondes , ensuite l' appréciation de la quantité de mémoire nécessaire pour effectuer les calculs .	algorithme de tri , le nombre de lignes à trier ) , que l' on privilégiera sur le coût exact en secondes , ensuite l' appréciation de la quantité de mémoire nécessaire pour effectuer les calculs .	
Bien sûr , on n' utilise la notion de compléxité amortie que dans les cas où cette réaction est très marginale .	Bien sûr , on n' utilise la notion de complexité amortie que dans les cas où cette réaction est très marginale .	
 Elements d' Algorithmique Tout un livre sur l' algorithmique , gratuit en PDF .	 Eléments d' Algorithmique Tout un livre sur l' algorithmique , gratuit en PDF .	
A la même époque , au douzième siècle , le moine Adelard de Bath a introduit le terme latin de algorismus ( par référence au nom de Al-Khuwarizmi ) .	À la même époque , au douzième siècle , le moine Adelard de Bath a introduit le terme latin de algorismus ( par référence au nom de Al-Khuwarizmi ) .	nettoyage , Typos fixed : . A → . À , AWB
Cela signifie que , pour certaines exécutions de l' algorithme ( car marginaux ) , la complexité de l' algorithme sera très supérieure au cas moyen .	Cela signifie que , pour certaines exécutions de l' algorithme ( cas marginaux ) , la complexité de l' algorithme sera très supérieure au cas moyen .	
L' Argentine est une républque .	L' Argentine est une république .	Relecture
Un accord a été trouvé avec ses derniers début 2005 , ceux-ci-devant renoncer à 75 % de leurs créances .	Un accord a été trouvé avec ses derniers début 2005 , ceux-ci devant renoncer à 75 % de leurs créances .	Restauration de la dernière version de 82 . 225 . 195 . 45
La plupart des services publics ont été privatisés pendant l' ère Mennem .	La plupart des services publics ont été privatisés pendant l' ère Menem .	
Historiquement , le pays est marqué par le bipartisme entre les parti Justicialiste ( ou Péroniste ) et le parti Radical ( Union Civique Radicale ( UCR ) ) et l' élection se fait normalement dès le premier tour .	Historiquement , le pays est marqué par le bipartisme entre le parti Justicialiste ( ou Péroniste ) et le parti Radical ( Union Civique Radicale ( UCR ) ) et l' élection se fait normalement dès le premier tour .	ortho
Carlos Menem , ancien président est arrivé en tête au premier tour avec 24 % des voix , suivi de Nestor Kirchner , proche de l' actuel président , Eduardo Duhalde , avec 22 % .	Carlos Menem , ancien président est arrivé en tête au premier tour avec 24 % des voix , suivi de Néstor Kirchner , proche de l' actuel président , Eduardo Duhalde , avec 22 % .	Élections présidentielles 2003
Un accord a été trouvé avec ses derniers début 2005 , ceux-ci devant renoncer à 75 % de leurs créances .	Un accord a été trouvé avec ces derniers début 2005 , ceux-ci devant renoncer à 75 % de leurs créances .	
Seuls les deux candidats qui ont remportés le plus de votes participent au deuxième tour ( 2003 ) .	Seuls les deux candidats qui ont remporté le plus de votes participent au deuxième tour ( 2003 ) .	Exécutif grammaire
Des groupes se réclamant de l' appellation IRA véritable ( Real IRA ) ont continué la lutte armée ( comme l' attentat d' Omagh en 1998 qui a fait 29 mort ) , mais semblent devoir s' éteindre après avoir été décimés par les arrestations .	Des groupes se réclamant de l' appellation IRA véritable ( Real IRA ) ont continué la lutte armée ( comme l' attentat d' Omagh en 1998 qui a fait 29 morts ) , mais semblent devoir s' éteindre après avoir été décimés par les arrestations .	
Elle a agi pendant de nombreuses années par la voie armée ( terroristes ou résistantes , selon les points de vue ) , mais elle semble privilégier depuis quelques années la voie du dialogue par l' entremise de sa branche politique , le Sinn Fein dirigé par Gerry Adams .	Elle a agi pendant de nombreuses années par la voie armée ( terroristes ou résistantes , selon les points de vue ) , mais elle semble privilégier depuis quelques années la voie du dialogue par l' entremise de sa branche politique , le Sinn Féin dirigé par Gerry Adams .	
Le nom se réfère généralement aujourd ' hui à lIRA provisoire ( Provisional IRA ) , qui s' est séparée dans les années 1960 et cherche à rattacher le Nord et le Republique de l' Irlande l' île et à libérer le Nord ( parfois improprement appelé Ulster alors qu ' il n' en forme qu ' une partie ) de la domination des Britanniques et des Protestants ( ces derniers étaient à l' origine des calvinistes écossais installés par le pouvoir royal ) .	Le nom se réfère généralement aujourd ' hui à lIRA provisoire ( Provisional IRA ) , qui s' est séparée dans les années 1960 et cherche à rattacher le Nord et le République d' Irlande l' île et à libérer le Nord ( parfois improprement appelé Ulster alors qu ' il n' en forme qu ' une partie ) de la domination des Britanniques et des Protestants ( ces derniers étaient à l' origine des calvinistes écossais installés par le pouvoir royal ) .	République d' Irlande
Le nom se réfère généralement aujourd ' hui à lIRA provisoire ( Provisional IRA ) , qui s' est séparée dans les années 1960 et cherche à rattacher le Nord et le République d' Irlande l' île et à libérer le Nord ( parfois improprement appelé Ulster alors qu ' il n' en forme qu ' une partie ) de la domination des Britanniques et des Protestants ( ces derniers étaient à l' origine des calvinistes écossais installés par le pouvoir royal ) .	Le nom se réfère généralement aujourd ' hui à lIRA provisoire ( Provisional IRA ) , qui s' est séparée dans les années 1960 et cherche à rattacher le Nord et la République d' Irlande et à libérer le Nord ( parfois improprement appelé Ulster alors qu ' il n' en forme qu ' une partie ) de la domination des Britanniques et des Protestants ( ces derniers étaient à l' origine des calvinistes écossais installés par le pouvoir royal ) .	
À la suite de la guerre d' indépendence de l' Irlande , ( 1919 -1921 ) , 26 comtés de l' Irlande sont devenus l' État libre d' Irlande , et la majeure partie de l' IRA est devenue l' armée nationale de l' État libre .	À la suite de la guerre d' indépendance de l' Irlande , ( 1919 -1921 ) , 26 comtés de l' Irlande sont devenus l' État libre d' Irlande , et la majeure partie de l' IRA est devenue l' armée nationale de l' État libre .	
En Irlande , plusieurs organisations ont porté ou portent le nom darmée républicaine irlandaise ( en anglais Irish Republic Army , ou IRA-en irlandais , Óglaigh na hÉireann ) .	En Irlande , plusieurs organisations ont porté ou portent le nom darmée républicaine irlandaise ( en anglais Irish Republican Army , ou IRA-en irlandais , Óglaigh na hÉireann ) .	
L' IRA est le resultat de la jonction entre les Volunteers et L' Irish Citizen Army de James Connolly a la suite de l' insurection de Pacques en 1916 .	L' IRA est le resultat de la jonction entre les Volunteers et L' Irish Citizen Army de James Connolly a la suite de l' insurection de Paques en 1916 .	
Ce combat dure jusqu ' en 1962 , date à laquelle l' IRA annonce un cessez-le-feu et semble devoir dispaître .	Ce combat dure jusqu ' en 1962 , date à laquelle l' IRA annonce un cessez-le-feu et semble devoir disparaître .	Histoire
L' IRA est le resultat de la jonction entre les Volunteers et L' Irish Citizen Army de James Connolly a la suite de l' insurection de Paques en 1916 .	L' IRA est le resultat de la jonction entre les Volunteers et L' Irish Citizen Army de James Connolly a la suite de l' insurrection de Paques en 1916 .	
L' IRA est le résultat de la jonction entre les Volunteers et L' Irish Citizen Army de James Connolly a la suite de l' insurrection de Paques en 1916 .	L' IRA est le résultat de la jonction entre les Volunteers et L' Irish Citizen Army de James Connolly a la suite de l' insurrection de Pâques en 1916 .	
L' IRA est le résultat de la jonction entre les Volunteers et L' Irish Citizen Army de James Connolly a la suite de l' insurrection de Pâques en 1916 .	L' IRA est le résultat de la jonction entre les Irish Volunteers et L' Irish Citizen Army de James Connolly à la suite de l' insurrection de Pâques en 1916 .	
l' hôtel de Brighton où sont hébergés le premier ministre Thatcher et ses ministres lors du congrès du parti conservateur est partiellement détruit par une bombe faisant 1 victime ( 1984 ) .	l' hôtel de Brighton où sont hébergés la première ministre Thatcher et ses ministres lors du congrès du parti conservateur est partiellement détruit par une bombe faisant 1 victime ( 1984 ) .	
 26 septembre 2005 Le général canadien John de Chastelain , chef de la Commission du désarmement , a annoncé que l' arsenal de l' IRA a été complètement démantelé	 26 septembre 2005 Le général canadien John de Chastelain , chef de la Commission du désarmement , annonce que l' arsenal de l' IRA a été complètement démantelé	
 1 août 2007 Les troupes britaniques se retirent officiellement de l' Irlande du nord pour laisser le plein contrôle à la police irlandaise	 1 août 2007 Les troupes britanniques se retirent officiellement de l' Irlande du nord pour laisser le plein contrôle à la police irlandaise	
L' Autriche fut annexée ( Anschluß ) par l' Allemagne nazie en 1938 .	L' Autriche fut annexée ( Anschluss ) par l' Allemagne nazie en 1938 .	lien Anschluss
« Alles Erdreich Ist Oestereich Unterthan ».	« Alles Erdreich ist Östereich untertan ».	
« Alles Erdreich ist Östereich untertan ».	« Alles Erdreich ist Österreich untertan ».	
 Article détaillé :	 Articles détaillés :	Géographie
Le BZÖ a été créé le 4 avril par Jörg Haider lors d' une scission de son parti d' extrême droite FPOe 	Le BZÖ a été créé le 4 avril par Jörg Haider lors d' une scission de son parti d' extrême droite FPÖ 	Politique liens sans redir
Le réseau routier est entretenu principalement par l' Etat .	Le réseau routier est entretenu principalement par l' État .	Transports titre
En mai 1955 , les ministres des affaires étrangères et les ambassadeurs d' Union soviétique , du Royaume-Uni , des États-Unis et de France , ainsi que le ministre autrichien des affaires étangères , Leopold Figl , signent le Traité d' État autrichien ( Staatsvertrag ) .	En mai 1955 , les ministres des affaires étrangères et les ambassadeurs d' Union soviétique , du Royaume-Uni , des États-Unis et de France , ainsi que le ministre autrichien des affaires étrangères , Leopold Figl , signent le Traité d' État autrichien ( Staatsvertrag ) .	ortho / typo , modèle " loupe " , liens wiki
254 millards de dollars ( en 2005 )	254 milliards de dollars ( en 2005 )	ortho / typo , modèle " loupe " , liens wiki
 Taux de chomâge :	 Taux de chômage :	relecture
La moyenne d' age des wagons de lÖBB est de 21 ans .	La moyenne d' âge des wagons de lÖBB est de 21 ans .	relecture
Certaines stations du réseau de tramway de Linz se trouvent sous-terre .	Certaines stations du réseau de tramway de Linz se trouvent sous terre .	relecture
D' autres entreprises sont également présentes dans le transport férré autrichien , détenues soit par les Lands , soit par le secteur privé .	D' autres entreprises sont également présentes dans le transport ferré autrichien , détenues soit par les Lands , soit par le secteur privé .	nettoyage AWB
Grace en partie à d' importantes subventions de la part de l' Etat fédéral autrichien , et selon lÖBB , ce mode de transport reviendrait environ 20 % moins cher aux transporteurs , et permet de plus aux chauffeurs de mieux respecter leurs temps de pause réglementaires .	Grace en partie à d' importantes subventions de la part de l' État fédéral autrichien , et selon lÖBB , ce mode de transport reviendrait environ 20 % moins cher aux transporteurs , et permet de plus aux chauffeurs de mieux respecter leurs temps de pause réglementaires .	nettoyage AWB
Vienne est la seule ville autrichienne a être équipée d' un véritable réseau de métro (" U- Bahn " ).	Vienne est la seule ville autrichienne à être équipée d' un véritable réseau de métro (" U- Bahn " ).	nettoyage AWB
Située au cœur de l' Europe centrale , l' Autriche a l' avantage de posséder des frontières communes avec huit pays .	70 % du pays est couvert par les Alpes , ou les riviéres ( Inn , Salzach , Drau , Mur ) tracent des vallés ou se concentre la vie humaine alpine .	Géographie --> Le rest etait pas encyclopadique , aussi il concerne le histoire et le industrie , pas le geographie !
Dans l' est il y a le Bassin de Vienne ou le Danube joindre la capitele autrichienne Vienne .	Dans l' est il y a le Bassin de Vienne ou le Danube joindre la capitale autrichienne Vienne .	Géographie
L' espérence de vie en Autriche s' élève à 82 .	L' espérance de vie en Autriche s' élève à 82 .	Démographie
70 % du pays est couvert par les Alpes , ou les riviéres ( Inn , Salzach , Drau , Mur ) tracent des vallés ou se concentre la vie humaine alpine .	70 % du pays est couvert par les Alpes , ou les rivières ( Inn , Salzach , Drau , Mur ) tracent des vallés ou se concentre la vie humaine alpine .	Géographie
70 % du pays est couvert par les Alpes , ou les rivières ( Inn , Salzach , Drau , Mur ) tracent des vallés ou se concentre la vie humaine alpine .	70 % du pays est couvert par les Alpes , ou les rivières ( Inn , Salzach , Drau , Mur ) tracent des vallées ou se concentre la vie humaine alpine .	Géographie
Située au cœur de l' Europe centrale , l' Autriche a l' avantage de posséder des frontières communes avec huit pays .	Située au cœur de l' Europe centrale , l' Autriche à l' avantage de posséder des frontières communes avec huit pays .	Géographie
70 % du pays est couvert par les Alpes , ou les rivières ( Inn , Salzach , Drau , Mur ) tracent des vallées où se concentré la vie humaine alpine .	70 % du pays est couvert par les Alpes , ou les rivières ( Inn , Salzach , Drau , Mur ) tracent des vallées où se concentre la vie humaine alpine .	Géographie
Malgré les montagnes , le pays posséde une agriculture prospére .	Malgré les montagnes , le pays posséde une agriculture prospère .	Géographie
