before	after	comments
Il a formé toute une génération de linguistes français , parmi lesquel Emile Benveniste , Marcel Cohen , Georges Dumézil , André Martinet , Aurélien Sauvageot , Lucien Tesnière , Joseph Vendryes .	Il a formé toute une génération de linguistes français , parmi lesquels Emile Benveniste , Marcel Cohen , Georges Dumézil , André Martinet , Aurélien Sauvageot , Lucien Tesnière , Joseph Vendryes .	nettoyage , Typos fixed : lesquel → lesquels , AWB
On peut alors décider le PNB des 8 pays à une date donnée ou l' ordre des pays est ordoné .	On peut alors décider le PNB des 8 pays à une date donnée ou l' ordre des pays est ordonné .	Présentation élémentaire
L' algèbre linéaire moderne a été étendu pour considérer les espaces de dimension arbitraire ou infini . Un espace vectoriel de dimension n est appellé un n- espace . La plupart des résultats obtenus dans les 2-espaces et 3-espaces peuvent être étendus aux espaces de dimensions supérieures . Bien que beaucoup de personnes ne peuvent appréhender correctement un vecteur dans un n- espace ils sont utiles pour représenter des données . Les vecteurs étant des listes ordonnées à n composants , la plupart des personnes peuvent manipuler des données efficacement dans cet environnement . Par exemple en économie on peut crééer et utiliser des vecteurs à 8 dimensions pour représenter le produit national brut de huit pays . On peut alors décider le PNB des 8 pays à une date donnée ou l' ordre des pays est ordonné .	L' algèbre linéaire moderne a été étendue pour considérer les espaces de dimension arbitraire ou infini . Un espace vectoriel de dimension n est appellé un n- espace . La plupart des résultats obtenus dans les 2-espaces et 3-espaces peuvent être étendus aux espaces de dimensions supérieures . Bien que beaucoup de personnes ne peuvent appréhender correctement un vecteur dans un n- espace ils sont utiles pour représenter des données . Les vecteurs étant des listes ordonnées à n composants , la plupart des personnes peuvent manipuler des données efficacement dans cet environnement . Par exemple en économie on peut crééer et utiliser des vecteurs à 8 dimensions pour représenter le produit national brut de huit pays . On peut alors décider le PNB des 8 pays à une date donnée ou l' ordre des pays est ordonné .	Présentation élémentaire
Un théorème intéressant à l' époque des mémoires d' ordinateurs de petite taille était qu ' on pouvait travailler séparément sur des sous-ensembles (" blocs " ) d' une matrice en les combinant ensuite par les mêmes règles qu ' on utilise pour combiner des scalaires dans le matrrices . Avec les mémoires actuelles de plusieurs Go , cette question a perdu un peu de son intérêt pratique .	Un théorème intéressant à l' époque des mémoires d' ordinateurs de petite taille était qu ' on pouvait travailler séparément sur des sous-ensembles (" blocs " ) d' une matrice en les combinant ensuite par les mêmes règles qu ' on utilise pour combiner des scalaires dans le matrices . Avec les mémoires actuelles de plusieurs Go , cette question a perdu un peu de son intérêt pratique .	Quelques théorèmes
On nomme algèbre linéaire la branche des mathématiques qui s' occupe de l' étude des vecteurs ( ensembles ordonnés de scalaires ) , des espaces vectoriels ( ou espaces linéaires ) , des transformation linéaires et des systèmes d' équation linéaires ( théorie des matrices ) .	On nomme algèbre linéaire la branche des mathématiques qui s' occupe de l' étude des vecteurs ( ensembles ordonnés de scalaires ) , des espaces vectoriels ( ou espaces linéaires ) , des transformations linéaires et des systèmes d' équation linéaires ( théorie des matrices ) .	typo + lien + modif
On nomme algèbre linéaire la branche des mathématiques qui s' occupe de l' étude des vecteurs ( ensembles ordonnés de scalaires ) , des espaces vectoriels ( ou espaces linéaires ) , des transformations linéaires et des systèmes d' équation linéaires ( théorie des matrices ) .	On nomme algèbre linéaire la branche des mathématiques qui s' occupe de l' étude des vecteurs ( ensembles ordonnés de scalaires ) , des espaces vectoriels ( ou espaces linéaires ) , des transformations linéaires et des systèmes d' équations linéaires ( théorie des matrices ) .	ortho
On nomme Algebre lineaire la branche des mathématiques qui se penche sur l' étude des espaces vectoriels ( ou espaces linéaires ) , de leurs éléments les vecteurs , des transformations linéaires et des systèmes d' équations linéaires ( théorie des matrices ) .	On nomme Algèbre lineaire la branche des mathématiques qui se penche sur l' étude des espaces vectoriels ( ou espaces linéaires ) , de leurs éléments les vecteurs , des transformations linéaires et des systèmes d' équations linéaires ( théorie des matrices ) .	Définition
Lalgèbre lineaire est la branche des mathématiques qui s' intéresse à l' étude des espaces vectoriels ( ou espaces linéaires ) , de leurs éléments les vecteurs , des transformations linéaires et des systèmes d' équations linéaires ( théorie des matrices ) .	Lalgèbre linéaire est la branche des mathématiques qui s' intéresse à l' étude des espaces vectoriels ( ou espaces linéaires ) , de leurs éléments les vecteurs , des transformations linéaires et des systèmes d' équations linéaires ( théorie des matrices ) .	
Ainsi , le Quicksort ( ou tri rapide ) , lorsque l' on choisi le premier élément comme pivot , se comporte de façon désastreuse si on l' applique à une liste de valeur ... déjà triée ! Il n' est donc pas judicieux de l' utiliser si on prévoit que le programme recevra en entrée des listes à peu près triées .	Ainsi , le Quicksort ( ou tri rapide ) , lorsque l' on choisit le premier élément comme pivot , se comporte de façon désastreuse si on l' applique à une liste de valeur ... déjà triée ! Il n' est donc pas judicieux de l' utiliser si on prévoit que le programme recevra en entrée des listes à peu près triées .	Quelques indications sur l' efficacité des algorithmes
Le substantif algorithmique désigne la méthode utilisant des algotithmes . Le terme est éégalement employé comme adjectf .	Le substantif algorithmique désigne la méthode utilisant des algorithmes . Le terme est éégalement employé comme adjectf .	Etude systématique
Le terme est éégalement employé comme adjectf .	Le terme est éégalement employé comme adjectif .	Etude systématique
Le terme est éégalement employé comme adjectif .	Le terme est également employé comme adjectif .	Etude systématique
Les algorithmes donts on a retrouvé des descriptions exhaustives ont été utilisés dès l' époque des Babyloniens , pour des calculs concernant le commerce et les impôts .	Les algorithmes dont on a retrouvé des descriptions exhaustives ont été utilisés dès l' époque des Babyloniens , pour des calculs concernant le commerce et les impôts .	Antiquité Ortographe
Le mot vient du nom du matématicien perse Abou Jafar Muhammad Ibn Mūsa al-Khuwārizmī ( en arabe : محمد بن موسى الخوارزمي ) , qui , dans le neuvième siècle écrivit le premier ouvrage systématique sur la solution des équations linéaires et quadratiques . Dans le cas général , l' algorithmique s' effectue au moyens de calculs .	Le mot vient du nom du mathématicien perse Abou Jafar Muhammad Ibn Mūsa al-Khuwārizmī ( en arabe : محمد بن موسى الخوارزمي ) , qui , dans le neuvième siècle écrivit le premier ouvrage systématique sur la solution des équations linéaires et quadratiques . Dans le cas général , l' algorithmique s' effectue au moyens de calculs .	
Au dix-septième siècle , on pourrait entrevroir une certaine allusion à la méthode algorithmique chez René Descartes dans la méthode générale proposée par le Discours de la méthode ( 1637 ) , notamment quand , en sa deuxième partie , le logicien français propose de : « diviser chacune des difficultés que j' examinerois , en autant de parcelles qu ' il se pourroit , et qu ' il seroit requis pour les mieux résoudre . ». Sans évoquer explicitement les concepts de boucle ou d' itération , l' approche de Descartes prédispose la logique accuellir le concept de " programme " , mot qui naît en français en 1677 .	Au dix-septième siècle , on pourrait entrevoir une certaine allusion à la méthode algorithmique chez René Descartes dans la méthode générale proposée par le Discours de la méthode ( 1637 ) , notamment quand , en sa deuxième partie , le logicien français propose de : « diviser chacune des difficultés que j' examinerois , en autant de parcelles qu ' il se pourroit , et qu ' il seroit requis pour les mieux résoudre . ». Sans évoquer explicitement les concepts de boucle ou d' itération , l' approche de Descartes prédispose la logique accuellir le concept de " programme " , mot qui naît en français en 1677 .	Etude systématique
Si les tâches s' exécutent sur un réseau de processeurs on parle d' algoritme distribué .	Si les tâches s' exécutent sur un réseau de processeurs on parle d' algorithme distribué .	coquille
Si les opérations s' éxécutent sur plusieurs processeurs en parallèle , on parle d' algorithme parallèle . Si les tâches s' exécutent sur un réseau de processeurs on parle d' algorithme réparti ou distribué .	Si les opérations s' exécutent sur plusieurs processeurs en parallèle , on parle d' algorithme parallèle . Si les tâches s' exécutent sur un réseau de processeurs on parle d' algorithme réparti ou distribué .	Définition
On se réfèrera aux articles suivants pour de plus amples détails :	On se référera aux articles suivants pour de plus amples détails :	Exemples d' algorithme
algorithme de tri , le nombre de lignes à trier ) , que l' on privégéliera sur le coût exact en secondes , ensuite l' appréciation de la quantité de mémoire nécessaire pour effectuer les calculs . Baser le calcul de la complexité d' un algorithme sur le temps ou la quantité effective de mémoire qu ' un ordinateur particulier prend pour effectuer ledit algorithme ne permet pas de prendre en compte la structure interne de l' algorithme , ni la particularité de l' ordinateur : selon sa charge de travail , la vitesse de son processeur , la vitesse d' accès aux données , l' exécution de l' algorithme ( qui peut faire intervenir le hasard ) ou son organisation de la mémoire , le temps d' exécution et la quantité de mémoire ne seront pas les mêmes .	algorithme de tri , le nombre de lignes à trier ) , que l' on privilégiera sur le coût exact en secondes , ensuite l' appréciation de la quantité de mémoire nécessaire pour effectuer les calculs . Baser le calcul de la complexité d' un algorithme sur le temps ou la quantité effective de mémoire qu ' un ordinateur particulier prend pour effectuer ledit algorithme ne permet pas de prendre en compte la structure interne de l' algorithme , ni la particularité de l' ordinateur : selon sa charge de travail , la vitesse de son processeur , la vitesse d' accès aux données , l' exécution de l' algorithme ( qui peut faire intervenir le hasard ) ou son organisation de la mémoire , le temps d' exécution et la quantité de mémoire ne seront pas les mêmes .	
Bien sûr , on n' utilise la notion de compléxité amortie que dans les cas où cette réaction est très marginale .	Bien sûr , on n' utilise la notion de complexité amortie que dans les cas où cette réaction est très marginale .	
Cela signifie que , pour certaines exécutions de l' algorithme ( car marginaux ) , la complexité de l' algorithme sera très supérieure au cas moyen . Bien sûr , on n' utilise la notion de complexité amortie que dans les cas où cette réaction est très marginale .	Cela signifie que , pour certaines exécutions de l' algorithme ( cas marginaux ) , la complexité de l' algorithme sera très supérieure au cas moyen . Bien sûr , on n' utilise la notion de complexité amortie que dans les cas où cette réaction est très marginale .	
L' Argentine est une républque . L' actuel président se nomme Duhalde .	L' Argentine est une république . L' actuel président se nomme Eduardo Duhalde .	Relecture
Historiquement , le pays est marqué par le bipartisme entre les parti Justicialiste ( ou Péroniste ) et le parti Radical ( Union Civique Radicale ( UCR ) ) et l' élection se fait normalement dès le premier tour .	Historiquement , le pays est marqué par le bipartisme entre le parti Justicialiste ( ou Péroniste ) et le parti Radical ( Union Civique Radicale ( UCR ) ) et l' élection se fait normalement dès le premier tour .	ortho
Un accord a été trouvé avec ses derniers début 2005 , ceux-ci devant renoncer à 75 % de leurs créances .	Un accord a été trouvé avec ces derniers début 2005 , ceux-ci devant renoncer à 75 % de leurs créances .	
Seuls les deux candidats qui ont remportés le plus de votes participent au deuxième tour ( 2003 ) . Historiquement , le pays est marqué par le bipartisme entre le parti Justicialiste ( ou Péroniste ) et le parti Radical ( Union Civique Radicale ( UCR ) ) et l' élection se fait normalement dès le premier tour .	Seuls les deux candidats qui ont remporté le plus de votes participent au deuxième tour ( 2003 ) . Historiquement , le pays est marqué par le bipartisme entre le parti Justicialiste ( ou Péroniste ) et le parti Radical ( Union Civique Radicale ( UCR ) ) et l' élection se fait normalement dès le premier tour .	Exécutif grammaire
Des groupes se réclamant de l' appellation IRA véritable ( Real IRA ) ont continué la lutte armée ( comme l' attentat d' Omagh en 1998 qui a fait 29 mort ) , mais semblent devoir s' éteindre après avoir été décimés par les arrestations .	Des groupes se réclamant de l' appellation IRA véritable ( Real IRA ) ont continué la lutte armée ( comme l' attentat d' Omagh en 1998 qui a fait 29 morts ) , mais semblent devoir s' éteindre après avoir été décimés par les arrestations .	
À la suite de la guerre d' indépendence de l' Irlande , ( 1919 -1921 ) , 26 comtés de l' Irlande sont devenus l' État libre d' Irlande , et la majeure partie de l' IRA est devenue l' armée nationale de l' État libre .	À la suite de la guerre d' indépendance de l' Irlande , ( 1919 -1921 ) , 26 comtés de l' Irlande sont devenus l' État libre d' Irlande , et la majeure partie de l' IRA est devenue l' armée nationale de l' État libre .	
Ce combat dure jusqu ' en 1962 , date à laquelle l' IRA annonce un cessez-le-feu et semble devoir dispaître . Cependant la violente répression des marches des droits civiques en Irlande du nord à la fin des années 1960 aboutit à la reconstitution de l' IRA .	Ce combat dure jusqu ' en 1962 , date à laquelle l' IRA annonce un cessez-le-feu et semble devoir disparaître . Cependant la violente répression des marches des droits civiques en Irlande du nord à la fin des années 1960 aboutit à la reconstitution de l' IRA .	Histoire
L' IRA est le resultat de la jonction entre les Volunteers et L' Irish Citizen Army de James Connolly a la suite de l' insurection de Paques en 1916 . Après cette insurection beaucoups de révoltés Irlandais sont assassinés par les Britanniques ( dont James Connolly , syndicaliste a l' origine de la creation de l' ICA ) . À la suite de la guerre d' indépendance de l' Irlande , ( 1919 -1921 ) , 26 comtés de l' Irlande sont devenus l' État libre d' Irlande , et la majeure partie de l' IRA est devenue l' armée nationale de l' État libre .	L' IRA est le resultat de la jonction entre les Volunteers et L' Irish Citizen Army de James Connolly a la suite de l' insurrection de Paques en 1916 . Après cette insurection beaucoups de révoltés Irlandais sont assassinés par les Britanniques ( dont James Connolly , syndicaliste a l' origine de la creation de l' ICA ) . À la suite de la guerre d' indépendance de l' Irlande , ( 1919 -1921 ) , 26 comtés de l' Irlande sont devenus l' État libre d' Irlande , et la majeure partie de l' IRA est devenue l' armée nationale de l' État libre .	
L' IRA est le résultat de la jonction entre les Volunteers et L' Irish Citizen Army de James Connolly a la suite de l' insurrection de Paques en 1916 . Par la suite , beaucoup de révoltés Irlandais sont assassinés par les Britanniques ( dont James Connolly , syndicaliste a l' origine de la creation de l' ICA ) . À la suite de la guerre d' indépendance de l' Irlande , ( 1919 -1921 ) , 26 comtés de l' Irlande sont devenus l' État libre d' Irlande , et la majeure partie de l' IRA est devenue l' armée nationale de l' État libre .	L' IRA est le résultat de la jonction entre les Volunteers et L' Irish Citizen Army de James Connolly a la suite de l' insurrection de Pâques en 1916 . Par la suite , beaucoup de révoltés Irlandais sont assassinés par les Britanniques ( dont James Connolly , syndicaliste a l' origine de la creation de l' ICA ) . À la suite de la guerre d' indépendance de l' Irlande , ( 1919 -1921 ) , 26 comtés de l' Irlande sont devenus l' État libre d' Irlande , et la majeure partie de l' IRA est devenue l' armée nationale de l' État libre .	
 1 août 2007 Les troupes britaniques se retirent officiellement de l' Irlande du nord pour laisser le plein contrôle à la police irlandaise	 1 août 2007 Les troupes britanniques se retirent officiellement de l' Irlande du nord pour laisser le plein contrôle à la police irlandaise	
Le réseau routier est entretenu principalement par l' Etat . Une taxe sur les véhicules existe sur le réseau autoroutier , sous la forme de vignette obligatoire ( 73 Euro en 2007 pour une vignette annuelle ) . Les camions doivent payer une redevance kilométrique ( maximum 0 , 273 Euro / Km ) à la société ASFINAG .	Le réseau routier est entretenu principalement par l' État . Une taxe sur les véhicules existe sur le réseau autoroutier , sous la forme de vignette obligatoire ( 73 Euro en 2007 pour une vignette annuelle ) . Les camions doivent payer une redevance kilométrique ( maximum 0 , 273 Euro / Km ) à la société ASFINAG .	Transports titre
En mai 1955 , les ministres des affaires étrangères et les ambassadeurs d' Union soviétique , du Royaume-Uni , des États-Unis et de France , ainsi que le ministre autrichien des affaires étangères , Leopold Figl , signent le Traité d' État autrichien ( Staatsvertrag ) . Cet événement est commémoré par le tirage d' une pièce de 2 euros frappée en mai 2005 .	En mai 1955 , les ministres des affaires étrangères et les ambassadeurs d' Union soviétique , du Royaume-Uni , des États-Unis et de France , ainsi que le ministre autrichien des affaires étrangères , Leopold Figl , signent le Traité d' État autrichien ( Staatsvertrag ) . Cet événement est commémoré par le tirage d' une pièce de 2 euros frappée en mai 2005 .	ortho / typo , modèle " loupe " , liens wiki
254 millards de dollars ( en 2005 )	254 milliards de dollars ( en 2005 )	ortho / typo , modèle " loupe " , liens wiki
 Taux de chomâge : 4 , 5 % ( fin 2005 ) selon les données européennes , 7 , 1 % ( avril 2005 ) selon les méthodes de calcul autrichiennes .	 Taux de chômage : 4 , 5 % ( fin 2005 ) selon les données européennes , 7 , 1 % ( avril 2005 ) selon les méthodes de calcul autrichiennes .	relecture
La moyenne d' age des wagons de lÖBB est de 21 ans . http : // derstandard . at : ÖBB leihen Waggons aus Polen und Rumänien . Publié le 14 . 01 . 2007	La moyenne d' âge des wagons de lÖBB est de 21 ans . http : // derstandard . at : ÖBB leihen Waggons aus Polen und Rumänien . Publié le 14 . 01 . 2007	relecture
D' autres entreprises sont également présentes dans le transport férré autrichien , détenues soit par les Lands , soit par le secteur privé .	D' autres entreprises sont également présentes dans le transport ferré autrichien , détenues soit par les Lands , soit par le secteur privé .	nettoyage AWB
Grace en partie à d' importantes subventions de la part de l' Etat fédéral autrichien , et selon lÖBB , ce mode de transport reviendrait environ 20 % moins cher aux transporteurs , et permet de plus aux chauffeurs de mieux respecter leurs temps de pause réglementaires .	Grace en partie à d' importantes subventions de la part de l' État fédéral autrichien , et selon lÖBB , ce mode de transport reviendrait environ 20 % moins cher aux transporteurs , et permet de plus aux chauffeurs de mieux respecter leurs temps de pause réglementaires .	nettoyage AWB
Vienne est la seule ville autrichienne a être équipée d' un véritable réseau de métro (" U- Bahn " ). Certaines stations du réseau de tramway de Linz se trouvent sous terre . Les villes de Vienne , Graz , Linz , Innsbruck et Gmunden possèdent également un réseau de tramway . Le village de Serfaus , situé dan le Tyrol , possède un " Luftkissenschwebebahn " sous-terrain , parfois considéré comme le métro le plus petit au monde .	Vienne est la seule ville autrichienne à être équipée d' un véritable réseau de métro (" U- Bahn " ). Certaines stations du réseau de tramway de Linz se trouvent sous terre . Les villes de Vienne , Graz , Linz , Innsbruck et Gmunden possèdent également un réseau de tramway . Le village de Serfaus , situé dan le Tyrol , possède un " Luftkissenschwebebahn " sous-terrain , parfois considéré comme le métro le plus petit au monde .	nettoyage AWB
Dans l' est il y a le Bassin de Vienne ou le Danube joindre la capitele autrichienne Vienne .	Dans l' est il y a le Bassin de Vienne ou le Danube joindre la capitale autrichienne Vienne .	Géographie
L' espérence de vie en Autriche s' élève à 82 . 1 ans pour les femmes et à 76 . 4 ans pour les hommes .	L' espérance de vie en Autriche s' élève à 82 . 1 ans pour les femmes et à 76 . 4 ans pour les hommes .	Démographie
70 % du pays est couvert par les Alpes , ou les riviéres ( Inn , Salzach , Drau , Mur ) tracent des vallés ou se concentre la vie humaine alpine . Malgré les montagne le pays posséde une agriculture prospére . Dans l' est il y a le Bassin de Vienne où le Danube joint la capitale autrichienne Vienne .	70 % du pays est couvert par les Alpes , ou les rivières ( Inn , Salzach , Drau , Mur ) tracent des vallés ou se concentre la vie humaine alpine . Malgré les montagne le pays posséde une agriculture prospére . Dans l' est il y a le Bassin de Vienne où le Danube joint la capitale autrichienne Vienne .	Géographie
70 % du pays est couvert par les Alpes , ou les rivières ( Inn , Salzach , Drau , Mur ) tracent des vallés ou se concentre la vie humaine alpine . Malgré les montagne le pays posséde une agriculture prospére . Dans l' est il y a le Bassin de Vienne où le Danube joint la capitale autrichienne Vienne .	70 % du pays est couvert par les Alpes , ou les rivières ( Inn , Salzach , Drau , Mur ) tracent des vallées ou se concentre la vie humaine alpine . Malgré les montagne le pays posséde une agriculture prospére . Dans l' est il y a le Bassin de Vienne où le Danube joint la capitale autrichienne Vienne .	Géographie
Située au cœur de l' Europe centrale , l' Autriche a l' avantage de posséder des frontières communes avec huit pays . C' est un pays montagneux : les Alpes occupent les deux tiers de la surface au sol . Le fleuve le plus long est le Danube , qui traverse également l' Allemagne , la Slovaquie , la Hongrie , la Serbie et la Roumanie . Son parcours en Autriche s' étend sur 350 km . Le point culminant est le Grossglockner , qui s' élève à 3797 mètres .	Située au cœur de l' Europe centrale , l' Autriche à l' avantage de posséder des frontières communes avec huit pays . C' est un pays montagneux : les Alpes occupent les deux tiers de la surface au sol . Le fleuve le plus long est le Danube , qui traverse également l' Allemagne , la Slovaquie , la Hongrie , la Serbie et la Roumanie . Son parcours en Autriche s' étend sur 350 km . Le point culminant est le Grossglockner , qui s' élève à 3797 mètres .	Géographie
70 % du pays est couvert par les Alpes , ou les rivières ( Inn , Salzach , Drau , Mur ) tracent des vallées où se concentré la vie humaine alpine . Malgré les montagnes , le pays posséde une agriculture prospére . Dans l' est il y a le Bassin de Vienne où le Danube joint la capitale autrichienne Vienne .	70 % du pays est couvert par les Alpes , ou les rivières ( Inn , Salzach , Drau , Mur ) tracent des vallées où se concentre la vie humaine alpine . Malgré les montagnes , le pays posséde une agriculture prospére . Dans l' est il y a le Bassin de Vienne où le Danube joint la capitale autrichienne Vienne .	Géographie
Malgré les montagnes , le pays posséde une agriculture prospére . Dans l' est il y a le Bassin de Vienne où le Danube joint la capitale autrichienne Vienne .	Malgré les montagnes , le pays posséde une agriculture prospère . Dans l' est il y a le Bassin de Vienne où le Danube joint la capitale autrichienne Vienne .	Géographie
Sur les murs intérieurs du monument sont inscrits les noms de 660 personalités militaires et de la République . Les noms de ceux qui moururent au combat sont soulignés .	Sur les murs intérieurs du monument sont inscrits les noms de 660 personnalités militaires et de la République . Les noms de ceux qui moururent au combat sont soulignés .	nettoyage AWB
